{
  "reportType": "V3_3_SECURITY_WP1_INVENTORY",
  "generatedAt": "2026-07-18T08:16:48.043Z",
  "database": {
    "configuredUrl": "file:./data/dev-sandbox.db",
    "resolvedPath": "C:\\Users\\maris\\Documents\\Project Management system 2\\project-ops-system\\data\\dev-sandbox.db",
    "classification": "SANDBOX_DEV",
    "bytes": 2748416,
    "sha256": "23664e484a69d253a3546d09fb0491353c93b06db7e4176454484bf74e02c4dc",
    "modifiedAt": "2026-07-17T11:08:38.417Z"
  },
  "checks": {
    "integrityCheck": [
      "ok"
    ],
    "foreignKeyCheck": [],
    "orphanCheckFailureCount": 0
  },
  "prisma": {
    "migrationCount": 43,
    "migrations": [
      {
        "migration_name": "20260429182306_init_simple",
        "started_at": 1777486986669,
        "finished_at": 1777486986710,
        "rolled_back_at": null,
        "applied_steps_count": 1
      },
      {
        "migration_name": "20260501091333_add_task_families",
        "started_at": 1777626813130,
        "finished_at": 1777626813145,
        "rolled_back_at": null,
        "applied_steps_count": 1
      },
      {
        "migration_name": "20260501171916_add_phases_workstreams",
        "started_at": 1777655956642,
        "finished_at": 1777655956677,
        "rolled_back_at": null,
        "applied_steps_count": 1
      },
      {
        "migration_name": "20260502135424_make_project_type_optional",
        "started_at": 1777730064151,
        "finished_at": 1777730064214,
        "rolled_back_at": null,
        "applied_steps_count": 1
      },
      {
        "migration_name": "20260503113213_add_project_workstream_active",
        "started_at": 1777807933012,
        "finished_at": 1777807933036,
        "rolled_back_at": null,
        "applied_steps_count": 1
      },
      {
        "migration_name": "20260503182432_remove_project_type_from_project_workstream",
        "started_at": 1777832672231,
        "finished_at": 1777832672305,
        "rolled_back_at": null,
        "applied_steps_count": 1
      },
      {
        "migration_name": "20260504090039_add_planned_actual_dates",
        "started_at": 1777885239243,
        "finished_at": 1777885239272,
        "rolled_back_at": null,
        "applied_steps_count": 1
      },
      {
        "migration_name": "20260504091801_add_planned_actual_dates_to_project_workstreams",
        "started_at": 1777886281385,
        "finished_at": 1777886281410,
        "rolled_back_at": null,
        "applied_steps_count": 1
      },
      {
        "migration_name": "20260504173049_add_project_templates",
        "started_at": 1777915849682,
        "finished_at": 1777915849705,
        "rolled_back_at": null,
        "applied_steps_count": 1
      },
      {
        "migration_name": "20260505061133_add_template_workstream_dates",
        "started_at": 1777961493038,
        "finished_at": 1777961493050,
        "rolled_back_at": null,
        "applied_steps_count": 1
      },
      {
        "migration_name": "20260506104017_add_project_events",
        "started_at": 1778064017243,
        "finished_at": 1778064017254,
        "rolled_back_at": null,
        "applied_steps_count": 1
      },
      {
        "migration_name": "20260506112625_add_event_types",
        "started_at": 1778224509977,
        "finished_at": 1778224510007,
        "rolled_back_at": null,
        "applied_steps_count": 1
      },
      {
        "migration_name": "20260511073642_extend_project_workstream_v2",
        "started_at": 1778485002837,
        "finished_at": 1778485002858,
        "rolled_back_at": null,
        "applied_steps_count": 1
      },
      {
        "migration_name": "20260511110905_extend_project_event_v2",
        "started_at": 1778497745852,
        "finished_at": 1778497745875,
        "rolled_back_at": null,
        "applied_steps_count": 1
      },
      {
        "migration_name": "20260511162320_add_project_event_workstream_link",
        "started_at": 1778516600596,
        "finished_at": 1778516600622,
        "rolled_back_at": null,
        "applied_steps_count": 1
      },
      {
        "migration_name": "20260512061500_add_project_tasks",
        "started_at": 1778566500653,
        "finished_at": 1778566500666,
        "rolled_back_at": null,
        "applied_steps_count": 1
      },
      {
        "migration_name": "20260512073129_add_project_task_sort_order",
        "started_at": 1778571089755,
        "finished_at": 1778571089779,
        "rolled_back_at": null,
        "applied_steps_count": 1
      },
      {
        "migration_name": "20260512120720_add_project_task_hierarchy",
        "started_at": 1778587640332,
        "finished_at": 1778587640370,
        "rolled_back_at": null,
        "applied_steps_count": 1
      },
      {
        "migration_name": "20260512143334_add_project_task_to_time_entries",
        "started_at": 1778596414504,
        "finished_at": 1778596414544,
        "rolled_back_at": null,
        "applied_steps_count": 1
      },
      {
        "migration_name": "20260512164014_add_project_risk_register",
        "started_at": 1778604014764,
        "finished_at": 1778604014811,
        "rolled_back_at": null,
        "applied_steps_count": 1
      },
      {
        "migration_name": "20260513144230_add_risk_actions",
        "started_at": 1778683350406,
        "finished_at": 1778683350425,
        "rolled_back_at": null,
        "applied_steps_count": 1
      },
      {
        "migration_name": "20260519164344_add_organization_branding_context",
        "started_at": 1779209024738,
        "finished_at": 1779209024822,
        "rolled_back_at": null,
        "applied_steps_count": 1
      },
      {
        "migration_name": "20260520100119_add_reporting_pack_workspace_fields",
        "started_at": 1779271279525,
        "finished_at": 1779271279547,
        "rolled_back_at": null,
        "applied_steps_count": 1
      },
      {
        "migration_name": "20260520115304_add_project_decision_register",
        "started_at": 1779277984510,
        "finished_at": 1779277984552,
        "rolled_back_at": null,
        "applied_steps_count": 1
      },
      {
        "migration_name": "20260523082226_decision_status_transition",
        "started_at": 1779524546752,
        "finished_at": 1779524546827,
        "rolled_back_at": null,
        "applied_steps_count": 1
      },
      {
        "migration_name": "20260524080723_status_usage",
        "started_at": 1779781824084,
        "finished_at": 1779781824146,
        "rolled_back_at": null,
        "applied_steps_count": 1
      },
      {
        "migration_name": "20260524110449_create_status_usage_table",
        "started_at": 1779781824149,
        "finished_at": 1779781824170,
        "rolled_back_at": null,
        "applied_steps_count": 1
      },
      {
        "migration_name": "20260525081747_add_status_scope",
        "started_at": 1779781824174,
        "finished_at": 1779781824213,
        "rolled_back_at": null,
        "applied_steps_count": 1
      },
      {
        "migration_name": "20260525094421_decision_status_to_generic_status",
        "started_at": 1779781824217,
        "finished_at": 1779781824277,
        "rolled_back_at": null,
        "applied_steps_count": 1
      },
      {
        "migration_name": "20260525164039_risk_status_to_generic_status",
        "started_at": 1779781824280,
        "finished_at": 1779781824330,
        "rolled_back_at": null,
        "applied_steps_count": 1
      },
      {
        "migration_name": "20260526100105_project_governed_status",
        "started_at": 1779789665414,
        "finished_at": 1779789665475,
        "rolled_back_at": null,
        "applied_steps_count": 1
      },
      {
        "migration_name": "20260527073510_workstream_governed_status",
        "started_at": 1779867310570,
        "finished_at": 1779867310597,
        "rolled_back_at": null,
        "applied_steps_count": 1
      },
      {
        "migration_name": "20260527132500_business_reference_codes",
        "started_at": 1779881491376,
        "finished_at": 1779881491376,
        "rolled_back_at": null,
        "applied_steps_count": 1
      },
      {
        "migration_name": "20260530083428_add_project_manager_contact",
        "started_at": 1780130069012,
        "finished_at": 1780130069058,
        "rolled_back_at": null,
        "applied_steps_count": 1
      },
      {
        "migration_name": "20260531084000_remove_legacy_risk_status",
        "started_at": 1780212450752,
        "finished_at": 1780212450813,
        "rolled_back_at": null,
        "applied_steps_count": 1
      },
      {
        "migration_name": "20260531094500_remove_risk_action_text_status",
        "started_at": 1780214194862,
        "finished_at": 1780214194942,
        "rolled_back_at": null,
        "applied_steps_count": 1
      },
      {
        "migration_name": "20260531101500_remove_decision_status_bridges",
        "started_at": 1780215082431,
        "finished_at": 1780215082551,
        "rolled_back_at": null,
        "applied_steps_count": 1
      },
      {
        "migration_name": "20260601165000_remove_project_bridges",
        "started_at": 1780325168100,
        "finished_at": 1780325168100,
        "rolled_back_at": null,
        "applied_steps_count": 1
      },
      {
        "migration_name": "20260601171220_agent_foundation",
        "started_at": 1780334128798,
        "finished_at": 1780334129077,
        "rolled_back_at": null,
        "applied_steps_count": 1
      },
      {
        "migration_name": "20260601180122_agent_configuration",
        "started_at": 1780336882623,
        "finished_at": 1780336882801,
        "rolled_back_at": null,
        "applied_steps_count": 1
      },
      {
        "migration_name": "20260602082851_agent_instruction_templates_and_intervals",
        "started_at": 1780388931273,
        "finished_at": 1780388931340,
        "rolled_back_at": null,
        "applied_steps_count": 1
      },
      {